{
  "$schema": "../../schemas/reusable-component-definition.schema.json",
  "reusable_component_definition_id": "RDEF-DOOR-FL-CANDIDATE-001",
  "canonical_name": null,
  "definition_status": "EMPTY_CANDIDATE",
  "interchangeability_status": "NOT_EVALUATED",
  "proven_vehicle_instance_ids": [],
  "cross_vehicle_comparison_ids": [],
  "schema_version": "1.0.0",
  "notes": "Empty candidate only. Not linked from CMPINST-VEH000001-DOOR-FL until interchangeability is proven. Outside exact vehicle applicability."
}
